[
  {
    "entry_id": "b6f9c2d8-1a2b-4f3e-9c7a-0a1b2c3d4e5f",
    "actor_id": "user_123",
    "actor_role": "user",
    "action": "invite_created",
    "target_id": "invite_789",
    "scope": ["checkin","metadata"],
    "metadata": {"guardian_contact":"parent@example.com"},
    "timestamp": "2025-12-12T15:22:00Z",
    "hash": "e3b0c44298fc1c149afbf4c8996fb92427ae41e4649b934ca495991b7852b855",
    "signature_version": "v1",
    "witness_receipt": null
  },
  {
    "entry_id": "c7d8e9f0-2b3c-4d5e-8f9a-1b2c3d4e5f60",
    "actor_id": "guardian_456",
    "actor_role": "guardian",
    "action": "invite_accepted",
    "target_id": "invite_789",
    "scope": ["checkin","metadata"],
    "metadata": {"verification_method":"phone_otp"},
    "timestamp": "2025-12-12T15:24:10Z",
    "hash": "a54d88e06612d820bc3be72877c74f257b561b19d3b9f2f1a1b2c3d4e5f67890",
    "signature_version": "v1",
    "witness_receipt": {
      "witness_id": "tesla_witness_01",
      "witness_hash": "9f86d081884c7d659a2feaa0c55ad015a3bf4f1b2c3d4e5f6a7b8c9d0e1f2345",
      "witness_timestamp": "2025-12-12T16:00:00Z"
    }
  }
]
